1940,infamous,"having a bad reputation, of bad report, notoriously vile"
1941,infernal,"hellish, fiendish, diabolical"
1942,infinite,"indefinably large, countlessly great, immense"
1943,infinitesimal,"incalculably, exceedingly, or immeasurably minute"
1944,inflammable,"capable of burning, easily set on fire"
1945,inflammatory,tending to inflame or provoke somebody
1946,inflexible,"not flexible, not capable of bending or being bent, stiff"
1947,infrequent,"rarely happening or present, only occasional"
1948,ingenious,"displaying genius or brilliance, tending to invent"
1949,ingenuous,naive and trusting
1950,inglorious,"ignominious, disgraceful, not famous, obscure"
1951,ingrate,ungrateful
1952,inherent,naturally a part or consequence of something
1953,inhospitable,"not inclined to hospitality, unfriendly"
1954,inhuman,of or pertaining to inhumanity and the indifferently cruel
1955,inimical,"adverse in tendency or effect, unfavorable, harmful"
1956,inimitable,"beyond imitation, surpassing all others, matchless"
1957,iniquitous,characterized by injustice or wickedness
1958,inland,"within the land, remote from the ocean"
1959,inmost,"the very deepest within, innermost"
1960,innate,"existing in one from birth, inborn, native"
1961,innocuous,"not harmful or injurious, harmless"
1962,innumerable,"not capable of being counted, indefinitely numerous"
1963,inoffensive,not offensive
1964,inopportune,unsuitable for some particular purpose
1965,inordinate,"excessive, unreasonable or inappropriate in magnitude"
1966,inscrutable,"difficult or impossible to comprehend, fathom, or interpret"
1967,insecure,not secure
1968,insensible,unable to be perceived by the senses
1969,insentient,"having no consciousness or animation, not sentient"
1970,inseparable,"not able to be separated, bound together permanently"
1971,insidious,intended to entrap or beguile
1972,insipid,"without distinctive, interesting, or stimulating qualities"
1973,insistent,standing or resting on something
1974,insolent,insulting in manner or words
1975,insouciant,"free from concern, worry, or anxiety, carefree, nonchalant"
1976,instant,"an infinitesimal or very short space of time, a moment"
1977,instructive,"conveying knowledge, information or instruction"
1978,insufficient,not sufficient
1979,insular,"of, pertaining to, being, or resembling an island or islands"
1980,insuperable,impossible to achieve or overcome or be negotiated
1981,insuppressible,that cannot be suppressed
1982,intangible,"incapable of being perceived by the senses, incorporeal"
1983,integral,"constituting a whole together, not omittable or removable"
1984,intelligible,"capable of being understood, comprehensible, clear"
1985,interim,"an intervening time, transitional, meantime"
1986,interminable,"existing or occurring without interruption or end, ceaseless"
1987,internecine,of or pertaining to conflict or struggle within a group
1988,intestate,to be without a valid will
1989,intolerable,"not capable of being borne or endured, insufferable"
1990,intoxicant,"an intoxicating agent, as alcohol or drugs"
1991,intracellular,inside or within a cell
1992,intractable,"not easily controlled, not docile or manageable, stubborn"
1993,intramural,pertaining to something within one institution
1994,intransigent,"unwilling to compromise or moderate a position, stubborn"
1995,intrepid,"resolutely fearless, dauntless"
1996,intrinsic,"innate, inherent, inseparable from itself, essential"
1997,introductory,"introducing, giving a preview or idea of"
1998,intuitive,"doesn't require conscious thought, understood by intuition"
1999,invaluable,"of great value, costly, precious, priceless"
2000,invariable,"not variable, constant"
2001,inventive,"of, or relating to invention"
2002,inverse,"reversed position, direction, or tendency"
2003,inveterate,"settled or confirmed in a habit, practice, or feeling"
2004,invidious,calculated to create ill will or resentment or give offense
2005,invincible,"impossible to defeat, destroy or kill"
2006,inviolable,not susceptible of violence or of being profaned/corrupted
2007,involuntary,"without intention, unintentional"
2008,invulnerable,"incapable of being wounded, or of receiving injury"
2009,inwardly,"in or on, or with reference to, the inside or inner part"
2010,irascible,"easily provoked to anger, very irritable"
2011,irate,"extremely angry, wrathful, enraged"
2012,iridescent,"producing a display of lustrous, rainbow-like colors"
2013,irksome,"disagreeable or troublesome, bothersome, annoying"
2014,irrational,"not rational, unfounded or nonsensical"
2015,irreducible,not able to be reduced or lessened
2016,irrefragable,"which cannot be refuted, indisputable, clearly right"
2017,irrefragable,not able to be refuted or disproved
2018,irrefrangible,"not to broken or transgressed, inviolable"
2019,irrefutable,"undeniable, unable to be disproved or refuted"
2020,irrelevant,"not related, not applicable, unimportant, not connected"
2021,irreligious,contrary to religious beliefs and practices
2022,irreparable,"incapable of being repaired, amended, cured or rectified"
2023,irrepressible,not containable or controllable
2024,irreproachable,"free from blame, not open to reproach or criticism"
2025,irresistible,not able to be resisted
2026,irresolute,undecided or unsure how to act
2027,irresponsible,lacking a sense of responsibility
2028,irreverent,"lacking proper respect or seriousness, sarcastic"
2029,irreversible,incapable of being reversed or turned about or back
2030,irrevocable,"unable to be retracted or reversed, final"
2031,irrhetorical,not rhetorical
2032,irritable,capable of being irritated
2033,isochronous,happening at regular intervals
2034,isothermal,of a process that takes place at constant temperature
2035,jejune,"without interest or significance, dull"
2036,jingoist,"the policy or practice of jingoes, bellicose chauvinism"
2037,jocose,"given to or characterized by joking, jesting, humorous"
2038,jocular,"characterized by, or intended for joking or jesting"
2039,jocund,"cheerful, merry, gay, blithe, glad"
2040,jovial,endowed with or characterized by a hearty or joyous humor
2041,jubilant,"showing great joy, satisfaction, or triumph, rejoicing"
2042,judicial,of or relating to a court of law
2043,judicious,"having, or characterized by, good judgment or sound thinking"
2044,jugular,"relating to, or located near, the neck or throat"
2045,juridical,"pertaining to the law or rule of law, legal, judicial"
2046,juvenile,"young, not fully developed"
2047,kindred,of the same nature
2048,kinetic,pertaining to motion
2049,knotty,full of knots
2050,laborious,"requiring much physical effort, toilsome"
2051,labyrinthine,"physically resembling a labyrinth, maze-like"
2052,lachrymose,"suggestive of or tending to cause tears, mournful"
2053,lackadaisical,showing no interest or enthusiasm
2054,lackluster,"lacking brilliance or radiance, dull"
2055,laconic,"using few words, concise"
2056,lacteal,relating to milk
2057,lactic,"of, relating to, or derived from milk"
2058,laggard,"hanging back, loitering"
2059,languid,"lacking in vigor or vitality, slack or slow"
2060,lascivious,"inclined to lustfulness, wanton, lewd"
2061,latent,"present but not visible, apparent, or actualized, potential"
2062,lateral,"of or pertaining to, situated at, or directed to a side"
2063,latish,somewhat or rather late
2064,laudable,"deserving praise, praiseworthy"
2065,laudatory,containing or expressing praise
2066,lax,"lenient and allowing for deviation, not strict"
2067,laxative,"having the effect of moving the bowels, or aiding digestion"
2068,leery,"cautious, hesitant, or nervous about something"
2069,leeward,away from the direction from which the wind is blowing
2070,legacy,"anything handed down from the past, as from a predecessor"
2071,legible,"being clear enough to be read, readable"
2072,legionary,"relating to, or consisting of a legion or legions"
2073,lenient,"lax, tolerant of deviation, permissive, not strict"
2074,leonine,"of, pertaining to, or characteristic of the lion"
2075,leviathan,"very large, gargantuan"
2076,lewd,"lascivious, sexually promiscuous, rude"
2077,liable,"bound or obliged in law or equity, responsible, answerable"
2078,libertarian,relating to the beliefs of libertarians
2079,licentious,"sexually unrestrained, lascivious, libertine, lewd"
2080,licit,not forbidden by formal or informal rules
2081,liege,"sovereign, independent, having right to allegiance"
2082,ligneous,"of, or resembling wood, woody"
2083,lilliputian,"extremely small, tiny"
2084,limpid,"clear, transparent, or pellucid, as water, crystal, or air"
2085,linear,"having the form of a line, straight"
2086,lingual,related to the tongue
2087,lissome,"lithe, quick and graceful in movement"
2088,listless,"having or showing little or no interest in anything, languid"
2089,literal,"exactly as stated, understood without extra interpretation"
2090,lithe,"bending readily, pliant, limber"
2091,lithesome,describing as being lithe
2092,litigious,of or relating to litigation
2093,littoral,"of or relating to the shore, especially the seashore"
2094,livid,"enraged, furiously angry"
2095,loath,"unwilling, reluctant, averse, disinclined"
2096,locative,"indicating place, or the place where, or wherein"
2097,lofty,"high, tall, having great height or stature"
2098,logical,in agreement with the principles of logic
2099,loquacious,"talking or tending to talk much or freely, talkative"
2100,lucid,"easily understood, completely intelligible or comprehensible"
2101,lucrative,"producing a surplus, profitable"
2102,ludicrous,"idiotic or unthinkable, often to the point of being funny"
2103,lugubrious,"mournful, dismal or gloomy, especially in an affected manner"
2104,lukewarm,temperature between warm and cool
2105,luminous,"emitting light, glowing brightly"
2106,lunar,"of, or pertaining to, the moon"
2107,lurid,"shocking, horrifying"
2108,luscious,"sweet and pleasant, delicious"
2109,lustrous,"having a glow, having luster, shining"
2110,luxurious,enjoying pleasures of luxury
2111,lying,"characterized by luxury, ministering or conducive to luxury"
2112,macabre,representing or personifying death
2113,magisterial,"befitting the status of a master, authoritative"
2114,magnanimous,generous in forgiving an insult or injury
2115,magniloquent,"speaking pompously, using swelling discourse, bombastic"
2116,maladroit,"unskillful, awkward, bungling"
2117,malcontent,"dissatisfied with current conditions, discontented"
2118,maleficent,harmful or evil in intent or effect
2119,malevolent,"having or displaying ill will, wishing harm on others"
2120,malicious,"of, pertaining to, or as a result of malice or spite"
2121,malignant,"disposed to cause harm, suffering, or distress deliberately"
2122,malleable,capable of being extended or shaped by hammering or pressure
2123,manipulatable,capable of being manipulated
2124,marginal,"of, relating to, or located at a margin or an edge"
2125,marine,"pertaining to the sea (marine biology, marine insurance)"
2126,maritime,related to the sea or sailing
2127,martial,"of, relating to, or suggestive of war, warlike"
2128,martian,of or pertaining to the planet mars
2129,massive,"of or pertaining to a large mass, weighty, heavy, or bulky"
2130,material,having to do with matter
2131,maternal,"having the characteristics of a mother, motherly"
2132,mawkish,"characterized by sickly sentimentality, maudlin"
2133,meager,"deficient in quantity or quality, lacking fullness"
2134,meddlesome,having a tendency to interfere in other people's business
2135,medial,of or pertaining to a mean or average
2136,medieval,in the style of the middle ages
2137,mediocre,"ordinary, not extraordinary, not special"
2138,meek,"humbly patient or docile, as under provocation from others"
2139,melancholy,affected with great sadness or depression
2140,mellifluous,"sweetly or smoothly flowing, sweet-sounding"
2141,mellow,"soft, sweet, and full-flavored from ripeness, as fruit"
2142,melodious,"having a pleasant melody or sound, tuneful"
2143,memorable,"worthy to be remembered, very important or remarkable"
2144,mendacious,"lying, untruthful or dishonest"
2145,mendicant,"begging, living on alms"
2146,menial,of or relating to work normally performed by a servant
2147,mephitic,foul-smelling
2148,mercantile,concerned with the exchange of goods for profit
2149,mercenary,working or acting merely for money or other reward
2150,merciful,showing mercy
2151,mercurial,"changeable, volatile, fickle"
2152,meretricious,alluring by a show of flashy or vulgar attractions
2153,meritorious,"deserving of merit or commendation, deserving reward"
2154,meticulous,"showing extreme care about minute details, precise"
2155,microscopic,invisible without the use of the microscope
2156,migratory,a species or thing that migrates
2157,militant,aggressive or combative
2158,miniature,smaller than normal
2159,minion,"favoured, beloved, ""pet"""
2160,minuscule,"tiny, very small"
2161,mischievous,"causing mischief, injurious"
2162,miscreant,"depraved, villainous or base"
2163,miserly,"like a miser, very covetous, stingy, cautious with money"
2164,misty,"with mist, foggy"
2165,mnemonic,assisting or intended to assist the memory
2166,moccasin,"soft leather shoe, originally worn by native americans"
2167,modish,conforming with fashion or style
2168,momentary,lasting for only a moment
2169,momentous,outstanding in importance
2170,monastic,of or relating to monasteries or monks
2171,monetary,"of, pertaining to, or consisting of money"
2172,monitory,giving admonition and warning
2173,morbid,"suggesting an unhealthy mental state, unwholesomely gloomy"
2174,mordacious,"biting, causing a physical bite or sting, corrosive"
2175,mordant,"sharply caustic or sarcastic, as wit or a speaker, biting"
2176,moribund,"in a dying state, near death"
2177,morose,"gloomily or sullenly ill-humored, as a person or mood"
2178,motley,"comprising greatly varied elements, heterogeneous"
2179,mountainous,"having many mountains, rough (terrain), rocky"
2180,multifarious,"having multiplicity, having great diversity or variety"
2181,multiform,having more than one shape or appearance
2182,mundane,"common, ordinary, banal, unimaginative"
2183,mundane ,lacking interest or excitement; dull.
2184,municipal,of a city which administers local government
2185,munificent,larger or more generous than is usual or necessary
2186,murky,"hard to see through, as a fog or mist"
2187,musty,having a stale odor
2188,mutable,liable or subject to change or alteration
2189,mystic,involving otherworldly or symbolic practices or content
2190,nasal,of or pertaining to the nose
2191,nascent,beginning to exist or develop
2192,natal,of or relating to birth
2193,natty,smart and fashionable
2194,nautical,"of or pertaining to sailors, ships, or navigation"
2195,naval,of or relating to a navy
2196,navigable,deep enough and wide enough to afford passage to vessels
2197,nefarious,"extremely wicked or villainous, iniquitous"
2198,neglectful,failing to take care of matters which require attention
2199,negligible,too small or unimportant to be of concern
2200,negotiable,able to be traversed
2201,neolithic,hopelessly outdated
2202,neural,"of, or relating to the nerves, neurons or the nervous system"
2203,neutral,"not taking sides in a conflict such as war, nonaligned"
2204,niggardly,"withholding for the sake of meanness, stingy, miserly"
2205,nimble,quick and light in movement or action
2206,nocturnal,primarily active during the night
2207,noiseless,"producing no noise, without noise"
2208,noisome,"offensive or disgusting, as an odor"
2209,noisy,"making a noise, especially a loud sound"
2210,nominal,"being such in name only, so-called"
2211,nonchalant,casually calm and relaxed
2212,noncommittal,reluctant to give out information or show one's opinion
2213,nondescript,"of no recognized, definite, or particular type or kind"
2214,notorious,"widely known, especially for something bad, infamous"
2215,novel,"new, original, especially in an interesting way"
2216,noxious,"harmful, injurious"
2217,nude,without clothing or other covering of the skin
2218,nugatory,"of no real value, trifling, worthless"
2219,numerical,of or pertaining to numbers
2220,nuptial,of or pertaining to wedding and marriage
2221,nutritive,of or pertaining to nutrition
2222,oaken,made from the wood of the oak tree
2223,obdurate,"stubborn, unyielding"
2224,obese,extremely overweight
2225,objective,"purpose, goal"
2226,oblique,neither perpendicular nor parallel to a line or surface
2227,oblong,describing something that is longer than it is wide
2228,obnoxious,"very annoying, offensive, odious or contemptible"
2229,obsequious,"showing servile complaisance or deference, fawning"
2230,observant,alert and paying close attention
2231,obsolete,"no longer in general use, fallen into disuse"
2232,obstinate,"firmly or stubbornly adhering to one's purpose, opinion"
2233,obstreperous,"resisting control or restraint in a difficult manner, unruly"
2234,obtuse,"not quick or alert in perception, not sensitive or observant"
2235,octogenarian,"being between the age of 80 and 89, inclusive"
2236,ocular,"of, or relating to the eye, or the sense of sight"
2237,odious,"deserving or causing hatred, hateful, detestable"
2238,odoriferous,having an odor or fragrance
2239,odorous,having a distinctive odor
2240,offhand,without planning or thinking ahead
2241,officious,"obliging, attentive, eager to please"
2242,olfactory,concerning the sense of smell
2243,ominous,"portending evil or harm, foreboding"
2244,omnipotent,"almighty or infinite in power, as god"
2245,omnipresent,being everywhere simultaneously
2246,omniscient,having total knowledge
2247,omnivorous,having a diet which is neither carnivorous nor herbivorous
2248,onerous,"burdensome, oppressive, or troublesome, causing hardship"
2249,opportune,suitable for some particular purpose
2250,opposite,located directly across from something else
2251,optic,"of, or relating to the eye or to vision"
2252,opulent,"luxuriant, and ostentatiously magnificent"
2253,oracular,of or relating to an oracle
2254,oral,"uttered by the mouth, spoken"
2255,ordinal,"of a number, indicating position in a sequence"
2256,ornate,"elaborately ornamented, often to excess"
2257,orthodox,"the traditional doctrines of an ideology, faith or religion"
2258,orthogonal,"pertaining to right angles, perpendicular (to)"
2259,ostensible,"outwardly appearing as such, professed"
2260,outlandish,"bizarre, strange"
2261,outright,complete or total
2262,overt,open and not secret nor concealed
2263,overweening,"unduly confident, arrogant, presumptuous, conceited"
2264,overweight,weighing too much or more than is considered normal
2265,overwrought,"in a state of excessive nervousness, excitement, or anger"
2266,pacific,"calm, peaceful"
2267,painstaking,"carefully attentive to details, diligent in a procedure"
2268,palatable,"pleasing to the taste, tasty"
2269,palatial,of or relating to a palace
2270,palliative,minimising progression of a disease for as long as possible
2271,pallid,"appearing weak, pale or wan"
2272,palpable,"capable of being touched, felt or handled"
2273,paltry,ridiculously or insultingly small
2274,paludal,of or pertaining to marshes
2275,pan-american,"of all the countries of north, central and south america"
2276,pandemic,"disease prevalent in a country, continent, or the world"
2277,parallel,"extending in same direction, never converging or diverging"
2278,paramount,"chief in importance or impact, supreme, preeminent"
2279,Parisian,"of, or pertaining to, or characteristic of paris, france"
2280,parlous,"perilous, dangerous"
2281,parochial,pertaining to a parish
2282,paronymous,containing the same root or stem as another word
2283,parsimonious,"extremely frugal, stingy"
2284,partible,divisible (able to be divided or partitioned)
2285,partisan,"a supporter of a person, group, party or cause"
2286,passible,"capable of feeling, especially suffering"
2287,passive,not reacting to something that should produce an emotion
2288,pastoral,having the simplicity or charm attributed to rural areas
2289,paternal,"of one's father, or his side of a family"
2290,patronymic,"derived from ancestors, as, a patronymic denomination"
2291,peaceable,"favouring peace rather than conflict, not aggressive"
2292,peaceful,not at war or disturbed by strife or turmoil
2293,peccable,"liable to sin, subject to transgress the divine law"
2294,peccant,guilty of a moral offence
2295,pectoral,"of or pertaining to the breast, the pectoral muscles"
2296,pecuniary,of or pertaining to money
2297,pedestrian,"lacking in vitality, imagination, distinction, etc"
2298,peerless,"without equal, unparalleled, best"
2299,peevish,"showing annoyance, irritation or bad mood"
2300,pejorative,"having a disparaging, derogatory or belittling effect"
2301,pellucid,"allowing for the passage of light, transparent"
2302,penitent,feeling or expressing sorrow for sin or wrongdoing
2303,penitential,pertaining to penance or penitence
2304,pensive,dreamily or wistfully thoughtful
2305,pentavalent,having a valence of 5
2306,penultimate,coming next-to-last in a sequence
2307,penurious,"extremely stingy, parsimonious, miserly"
2308,perceptive,"having keenness of perception, insight or intuition"
2309,percipient,"having the ability to perceive, especially quickly"
2310,peremptory,leaving no opportunity for denial or refusal
2311,perennial,"remaining active throughout the year, or all the time"
2312,perfectible,"able to be perfected, capable of perfection"
2313,perfidious,"deliberately faithless, treacherous"
2314,perfunctory,"performed merely as a routine duty, hasty and superficial"
2315,perilous,dangerous
2316,peripatetic,tending to walk about
2317,peripheral,pertaining to the outside surface or boundary of an area
2318,permanent,"without end, eternal"
2319,permeable,capable of being penetrated
2320,permissible,allowable
2321,pernicious,causing insidious harm or ruin
2322,perpendicular,(geometry) meeting a given line or surface at right angles
2323,perpetual,"lasting forever, or for an indefinitely long time"
2324,persnickety,fastidious or fussy
2325,personable,"having a pleasing manner, friendly, amiable"
2326,personal,"coming from a particular person, individual, private"
2327,perspective,depicting spatial relationships on a flat surface
2328,perspicacious,having keen mental perception and understanding
2329,perspicuous,clearly expressed or presented
2330,persuadable,capable of being convinced
2331,pertinacious,holding tenaciously to an opinion or purpose
2332,pertinent,"important with regards to (a subject or matter), relevant"
2333,pervasive,"manifested throughout, penetrating or affecting everything"
2334,perverse,willfully determined to go counter to what is expected
2335,pervious,admitting of passage or entrance
2336,pestilent,"highly injurious or destructive to life, deadly"
2337,petrous,"like stone, especially in hardness"
2338,petulant,"showing sudden, impatient irritation"
2339,phenomenal,"very remarkable, highly extraordinary, amazing"
2340,philanthropic,benevolent
2341,phlegmatic,not easily excited to action or display of emotion
2342,phonetic,relating to the sounds of spoken language
2343,phonic,of or pertaining to speech sound
2344,photoelectric,pertaining to electric effects produced by light
2345,picaresque,a form of fiction depicting the adventures of a roguish hero
2346,picayune,"petty, trivial, of little consequence"
2347,piecemeal,made or done in pieces or one stage at a time
2348,pied,having patches of two or more colours
2349,pious,having a dutiful spirit of reverence for god
2350,piquant,agreeably pungent or sharp in taste or flavour
2351,piteous,evoking or deserving pity
2352,pithy,"brief, forceful and meaningful in expression"
2353,pitiable,"evoking or deserving pity, pitiful"
2354,pitiful,evoking or deserving pity
2355,pitiless,feeling or showing no pity
2356,pivotal,of vital or critical importance
2357,placid,"calm and quiet, peaceful, tranquil"
2358,plaintive,"sorrowful, mournful or melancholic"
2359,platonic,free from sensual desire
2360,plausible,"seemingly or apparently likely, or acceptable"
2361,pleasant,"giving pleasure, pleasing in manner"
2362,pleasurable,enjoyable
2363,plebeian,belonging or pertaining to the common people
2364,plebian,alternative spelling of plebeian
2365,plenary,"fully attended, for everyone's attendance"
2366,plenipotentiary,a person with power to do business on behalf of another
2367,plenteous,"of or pertaining to plenty, abundance"
2368,pliable,easily bent
2369,pliant,"capable of bending, flexible, pliable"
2370,pluperfect,perfect with respect to a point of reference in past time
2371,plural,consisting of or containing more than one of something
2372,pneumatic,of or relating to air or other gases
2373,poetic,possessing the qualities or charm of poetry
2374,poignant,keenly distressing to the feelings
2375,polar,of or relating to the north or south pole
2376,politic,shrewd or prudent in practical matters
2377,polyglot,able to speak or write several languages
2378,polytechnic,offering instruction in a variety of technical subjects
2379,pompous,"affectedly grand, solemn or self-important"
2380,populous,"full of residents, as a region, heavily populated"
2381,portentous,"ominously significant, portending evil"
2382,portly,rather heavy or fat
2383,posterior,"located behind, or towards the rear of an object"
2384,postgraduate,further studies after completing a degree
2385,posthumous,"arising, occurring or continuing after one's death"
2386,potable,good for drinking without fear of poisoning or disease
2387,potent,"powerful, mighty"
2388,potential,"existing in possibility, not in actuality"
2389,pragmatic,pertaining to a practical point of view
2390,precipitant,falling headlong
2391,precipitous,extremely steep
2392,precise,"exact, accurate"
2393,precocious,unusually advanced or mature in development
2394,predatory,"of, or relating to a predator"
2395,preeminent,exceeding others in quality or rank
