1493,dutiful,accepting of one's obligations and willing to do them well
1494,dynamic,"characterized by constant change, activity, or progress"
1495,earnest,"ardent in the pursuit of an object, eager to obtain or do"
1496,eatable,"able to be eaten, edible"
1497,ebullient,cheerful and full of energy
1498,eccentric,unconventional and slightly strange
1499,eclectic,made up of things selected from various sources
1500,ecstatic,feeling or characterized by extreme happiness
1501,ecumenical,"interdenominational, sometimes by extension, interreligious"
1502,edible,"that can be eaten without harm, non-toxic to humans"
1503,editorial,"of, or relating to the preparing of material for publication"
1504,effective,successful in producing a desired or intended result
1505,effectual,"producing the intended result, entirely adequate"
1506,effervescent,"giving off bubbles, fizzy"
1507,effete,"of substances, quantities etc: exhausted, spent, worn-out"
1508,efficacious,effective
1509,efficient,making good use of time or energy
1510,efflorescent,bursting into flower
1511,effulgent,"shining, resplendent, with radiant splendor"
1512,effusive,expressing feelings in an unrestrained or heartfelt manner
1513,egalitarian,characterized by equality for all people
1514,egocentric,regarding the self as the center of all things
1515,elated,"very happy or proud, jubilant, in high spirits"
1516,eleemosynary,"relating to charity, alms, or almsgiving"
1517,eligible,having the right to do or obtain something
1518,elite,"of high birth or social position, aristocratic or patrician"
1519,elliptical,"in a shape reminding of an ellipse, oval"
1520,eloquent,fluently persuasive and articulate
1521,elusive,"evading capture, comprehension or remembrance"
1522,emergent,in the process
1523,emeritus,having retired but retaining his title as an honor
1524,eminent,(a person) famous and respected within a particular sphere
1525,emollient,having the quality of softening or soothing the skin
1526,emphatic,expressing something forcibly and clearly
1527,empirical,pertaining to or based on experience
1528,encyclical,intended for general circulation
1529,endemic,natural to or characteristic of a specific people or place
1530,energetic,"possessing, exerting, or displaying energy"
1531,enigmatic,"perplexing, mysterious, resembling an enigma"
1532,enormous,"deviating from the norm, unusual, extraordinary"
1533,enthusiastic,"with zealous fervor, excited, motivated"
1534,ephemeral,"lasting a very short time, short-lived, transitory"
1535,epicurean,"pursuing pleasure, esp. in reference to food or comfort"
1536,epidemic,"like or having to do with an epidemic, widespread"
1537,epistolary,"of or relating to letters, or the writing of letters"
1538,epizootic,like or having to do with an epidemic among animals
1539,equable,"unvarying, calm and steady, constant and uniform"
1540,equestrian,of horseback riding or horseback riders
1541,equine,of or relating to a horse or horses
1542,equitable,"characterized by equity or fairness, fair, reasonable"
1543,equivalent,"similar or identical in value, meaning or effect"
1544,equivocal,"of doubtful nature or character, questionable, dubious"
1545,errant,straying from the proper course or standard
1546,erratic,"unsteady, prone to unexpected changes, not consistent"
1547,erroneous,"containing error, mistaken, incorrect, wrong"
1548,ersatz,"made in imitation, artificial"
1549,erudite,"characterized by great knowledge, learned or scholarly"
1550,esoteric,understood by or meant for only a select few
1551,estimable,"worthy of esteem, admirable"
1552,ethereal,"light, airy, or tenuous, delicate"
1553,eugenic,of bringing about improvement in produced offspring
1554,euphonious,"pleasant-sounding, agreeable to the ear"
1555,euphoric,feeling of great well-being or intense feeling of happiness
1556,eureka,an exclamation of triumph at a discovery
1557,evanescent,"vanishing, fading away, fleeting"
1558,evangelical,pertaining to the gospel(s) of the christian new testament
1559,evasive,tending to avoid making revelations about oneself
1560,eventual,happening at some indefinite future time
1561,evidential,of or providing evidence
1562,exact,strictly accurate or correct
1563,exceptionable,"liable to exception  or objection, objectionable"
1564,excess,"more than is normal, necessary or specified"
1565,excitable,easily excited
1566,excusable,possible to excuse
1567,execrable,"utterly detestable, abominable, abhorrent"
1568,exemplary,"worthy of imitation, commendable"
1569,exhaustive,including every possible element
1570,exigent,"urgent, needing immediate action"
1571,existential,"of, or relating to existence"
1572,exorbitant,"exceeding proper limits, extravagant"
1573,exotic,"foreign, with the connotation of excitingly foreign"
1574,expedient,"simple, easy, or quick, convenient"
1575,expeditious,"fast, prompt, speedy"
1576,explicit,"very specific, clear, or detailed"
1577,expository,"serving to explain, explicate, or elucidate"
1578,expressive,effectively conveying thought or feeling
1579,extant,"in existence, still existing, not destroyed or lost"
1580,extemporaneous,"without preparation or advanced thought, offhand"
1581,extempore,"carried out with no preparation, impromptu"
1582,extensible,capable of being extended
1583,extensive,"in the nature of an extent, wide, widespread"
1584,external,outside of something
1585,extinct,"no longer in existence, that has ended or died out"
1586,extrajudicial,carried out without legal authority
1587,extraneous,"not belonging to, or dependent upon, a thing"
1588,extraordinary,"not ordinary, exceptional, unusual"
1589,extravagant,"spending much more than is necessary or wise, wasteful"
1590,extremist,"holding extreme views, especially on a political subject"
1591,extrinsic,"external, separable from the thing itself, inessential"
1592,exuberance,effusively and almost uninhibitedly enthusiastic
1593,exuberant,"very high-spirited, extremely energetic or enthusiastic"
1594,fabulous,"extraordinary, especially in being very large"
1595,facetious,not meant to be taken seriously or literally
1596,facile ,"moving, acting, working, proceeding, etc , with ease"
1597,factious,"of, pertaining to, or caused by factions"
1598,fallacious,"containing a fallacy,  logically unsound"
1599,fallible,capable of making mistakes or being wrong
1600,fanatical,having an extreme zeal or enthusiasm for something
1601,fanciless,"having no fancy, without ideas or imagination"
1602,farcical,"resembling a farce, ludicrous, absurd"
1603,fastidious,"excessively particular, demanding, or fussy about details"
1604,fatuous,"foolish or inane, especially in an unconscious manner, silly"
1605,faulty,having or displaying faults not adequate or acceptable
1606,feasible,that can be done in practice
1607,febrile,"feverish, or having a high temperature"
1608,feckless,"ineffective, incompetent, futile"
1609,fecund,"highly fertile, able to produce offspring"
1610,felicitous,"well-suited for the occasion, as an action or expression"
1611,felonious,"having the quality of felony, malignant, malicious"
1612,feminine,"of the female sex, biologically female, not male, womanly"
1613,feral,"existing in a natural state, not domesticated, wild"
1614,ferocious,marked by extreme and violent energy
1615,fertile,"capable of growing abundant crops, productive"
1616,fervent,having or showing great warmth or intensity of spirit
1617,fervid,"heated or vehement in spirit, enthusiasm, etc"
1618,festal,"festive, relating to a festival or feast"
1619,festive,"having the atmosphere,or attitude of a celebration"
1620,fetid,"having an offensive odor, stinking"
1621,feudal,"of, or relating to the feudal system"
1622,fickle,"likely to change, casually changeable"
1623,fictitious,"not real, invented, contrived"
1624,fiducial,accepted as a fixed basis of reference
1625,figurative,"metaphorical, as opposed to literal"
1626,filial,"of, pertaining to, or befitting a son or daughter"
1627,financial,pertaining or relating to money matters
1628,finicky,"fastidious and fussy, difficult to please, exacting"
1629,finite,"having bounds or limits, not infinite, measurable"
1630,fiscal,"related to the treasury of a country, company, or region"
1631,fitful,"irregular, unsteady, characterized by fits"
1632,flaccid,"soft and limp, not firm, flabby"
1633,flagrant,"obvious and offensive, blatant, scandalous"
1634,flamboyant,"showy, bold or audacious in behaviour, appearance, etc"
1635,flammable,"capable of burning, especially a liquid"
1636,fledgling,untried or inexperienced
1637,flexible,"capable of being flexed, bent or twisted, without breaking"
1638,flimsy,"likely to bend or break under pressure, weak, shaky"
1639,flippant,"frivolously disrespectful, shallow or lacking in seriousness"
1640,floral,"of, pertaining to, or connected with flowers"
1641,florid,"having a rosy or pale red colour, ruddy"
1642,fluent,"able to speak a language accurately, rapidly and confidently"
1643,fluvial,of or pertaining to a river
1644,fog,a cloudlike mass or layer of minute water droplets
1645,foible,"a minor weakness or failing of character, slight flaw"
1646,foppish,"like a fop, a man overly concerned with his appearance"
1647,forby,"close by, near"
1648,forcible,done or effected by force
1649,foreign,from a different country
1650,forensic,relating to the use of science in investigation of evidence
1651,forlorn,"desolate or dreary, as in feeling, condition"
1652,formidable,"causing fear, apprehension, or dread"
1653,forte,"a person's strong suit, talent, or skill"
1654,fortuitous,"happening or produced by chance, accidental"
1655,fourth,being one of four equal parts
1656,fractious,refractory or unruly
1657,fragile,easily broken or destroyed and often of subtle structure
1658,frantic,"desperate or wild with excitement, passion, fear, pain, etc"
1659,fraternal,of brothers (fraternal twins)
1660,fraudulent,"dishonest, based on fraud or deception"
1661,fraught,filled or charged
1662,frenetic,"frantic, frenzied"
1663,fretful,"irritable, bad-tempered, grumpy or peevish"
1664,frightful,frightened
1665,frigid,"very cold, lacking warmth, icy"
1666,frivolous,"silly, especially at an inappropriate time"
1667,frolicsome,"given to frolicking, playful"
1668,frontal,"of, in, or at the front"
1669,frontier,"lying on the exterior part, bordering"
1670,froward,"willfully contrary, not easily managed"
1671,frowzy,"dirty and untidy, slovenly"
1672,frugal,avoiding unnecessary expenditure either of money
1673,fugacious,"fleeting, fading quickly, transient"
1674,fulsome,"offensive to good taste, especially as being excessive"
1675,fundamental,pertaining to the foundation or basis
1676,fungible,being of such nature or kind as to be freely exchangeable
1677,fungous,"of or pertaining to a fungus, fungal"
1678,furrier,"comparative form of furry, more furry"
1679,furtive,"taken, done, used, etc , surreptitiously or by stealth"
1680,fusible,able to be fused or melted
1681,futile,"incapable of producing any result, ineffective, useless"
1682,futurist,in the style of futurism
1683,gaily,"merrily, joyfully"
1684,gallant,"brave, valiant"
1685,galore,in abundance
1686,galvanic,"of or pertaining to galvanism, electric"
1687,gargantuan,of the giant gargantua or his appetite
1688,garish,"overly ostentatious, so colourful as to be in bad taste"
1689,garrulous,"excessively talkative, rambling"
1690,gaseous,"relating to, or existing as, gas"
1691,gastric,of or relating to the stomach
1692,gauche,"awkward or lacking in social graces, bumbling"
1693,gaunt,"lean, angular, and bony"
1694,generic,"very comprehensive, pertaining or appropriate to big groups"
1695,genial,"warmly and pleasantly cheerful, cordial"
1696,genital,"of, or relating to biological reproduction"
1697,genitive,the case which expresses origin or possession (grammar)
1698,genteel,polite and well-mannered
1699,gentile,non-jewish
1700,germane,related to the topic being discussed or considered
1701,germinal,pertaining or belonging to a germ
1702,ghastly,horrifyingly shocking
1703,ghoulish,of or pertaining to ghouls
1704,giddy,to make dizzy or unsteady
1705,gigantic,very large
1706,gingerly,with great care or caution
1707,glacial,"of, or relating to glaciers"
1708,globose,having a globular form
1709,globular,roughly spherical in shape
1710,glorious,"attributes, qualities, or acts that are worthy of glory"
1711,glutinous,"glue-like, sticky, viscid"
1712,gluttonous,"given to excessive eating, prone to overeating"
1713,gnarled,knotty and misshapen
1714,gordian,resembling the gordian knot in intricacy
1715,gothic,a style of architecture from the mid-12th century
1716,graceless,without grace
1717,grandiloquent,"overly wordy, pompous, flowery, or elaborate"
1718,grandiose,"large and impressive, in size, scope or extent"
1719,granular,"consisting of, or resembling, granules or grains"
1720,gratis,"free, without charge"
1721,gratuitous,"being without apparent reason, cause, or justification"
1722,gregarious,"fond of the company of others, sociable"
1723,grievous,"causing grief, pain or sorrow"
1724,grisly,"horrifyingly repellent, terrifying, gruesome"
1725,gritty,"containing sand or grit, full of hard particles"
1726,grotesque,"distorted and unnatural in shape or size, abnormal, hideous"
1727,gruff,"to have a rough, surly, or harsh nature"
1728,guileless,"sincere, honest, straightforward, frank"
1729,gullible,easily deceived or cheated
1730,gustatory,"of, or relating to, the sense of taste"
1731,habitable,"safe and comfortable, fit for habitation"
1732,habitual,"behaving in a regular manner, as a habit"
1733,hackneyed,"made commonplace or trite, stale"
1734,haggard,"looking exhausted and unwell, in poor condition"
1735,halcyon,"calm, peaceful, tranquil"
1736,hale,"free from disease or infirmity, robust, vigorous"
1737,haphazard,"random, chaotic, incomplete, not thorough"
1738,hapless,"unlucky, luckless, unfortunate"
1739,hard-hearted,"unfeeling, unmerciful, pitiless"
1740,hardy,"having rugged physical strength, inured to fatigue"
1741,harmonious,"marked by agreement in feeling, attitude, or action"
1742,harrowing,"extremely disturbing or distressing, grievous"
1743,haughty,"disdainfully proud, snobbish, scornfully arrogant"
1744,headstrong,"determined to do as one pleases, and not as others want"
1745,heartrending,"that causes great grief, anguish or distress"
1746,heathenish,somewhat like a heathen
1747,heinous,"hateful, odious, abominable, totally reprehensible"
1748,herbaceous,"of, pertaining to, or characteristic of an herb"
1749,herbivorous,feeding only on plants
1750,herculean,"requiring the great strength of a hercules, hard to perform"
1751,hereditary,passing naturally from parent to offspring through the genes
1752,heretical,of or pertaining to heresy or heretics
1753,hermetic,made airtight by fusion or sealing
1754,hesitant,"tending to hesitate, wait, or proceed with caution"
1755,heterodox,religious teachings not different enough to be heretical
1756,heterogeneous,"diverse in kind or nature, composed of diverse parts"
1757,heteromorphic,having different forms in different stages of the life cycle
1758,hexangular,having six angles or corners
1759,hexapod,"having six feet, six-footed"
1760,hibernal,"of or pertaining to winter, brumal or hiemal"
1761,hibernian,"characteristic of ireland or its inhabitants, irish"
1762,hidebound,bound with the hide of an animal
1763,hideous,"frightful, shocking, extremely ugly"
1764,hindmost,"furthest behind or nearest the rear, last"
1765,hirsute,"hairy, shaggy"
1766,histrionic,"of, or relating to actors or acting"
1767,hoarse,"afflicted by a dry, quite harsh voice"
1768,hoary,white or gray with age
1769,homologous,showing a degree of correspondence or similarity
1770,hospitable,cordial and generous towards guests
1771,humane,having regard for the health and well-being of another
1772,humanitarian,having concern for or helping to improve people's welfare
1773,humble,"not proud or arrogant, modest"
1774,humdrum,"lacking variety, boring, dull"
1775,hydraulic,"operated by, or employing water or other liquids in motion"
1776,hydroelectric,generating electricity by using the energy of moving water
1777,hydrous,"containing combined water, hydrated"
1778,hypercritical,meticulously or excessively critical
1779,hypnotic,of or pertaining to hypnosis or hypnotism
1780,hypochondriac,an excessive preoccupation with and worry about one's health
1781,hypocritical,characterized by hypocrisy or being a hypocrite
1782,hypodermic,pertaining to parts under the skin
1783,hypothetical,"based upon a hypothesis, conjectural"
1784,ichthyic,"of, pertaining to, or like fish, piscine"
1785,idolatrous,worshipping idols
1786,idyllic,"of or pertaining to idylls, charmingly simple or rustic"
1787,ignoble,"not noble, plebeian, common"
1788,ignominious,"discreditable, humiliating"
1789,ill-natured,"bad-tempered, irritable or malevolent"
1790,illegitimate,born out of wedlock
1791,illiberal,"restrictive to individual choice and freedom, authoritarian"
1792,illicit,"lacking licitness, but not invalid"
1793,illimitable,"impervious to limitation, without limit"
1794,illiterate,unable to read and write
1795,illogical,"contrary to logic, lacking sense or sound reasoning"
1796,illusive,subject to or pertaining to an illusion
1797,illusory,"resulting from an illusion, deceptive, imaginary, unreal"
1798,illustrious,"highly distinguished, renowned, famous"
1799,imaginary,existing only in the imagination
1800,immaculate,"free from spot or stain, immaculately clean"
1801,immaterial,having no matter or substance
1802,immature,"not fully formed or developed, unripe"
1803,immeasurable,impossible to measure
1804,immense,"huge, gigantic, very large"
1805,immigrant,of or relating to immigrants or the act of immigrating
1806,imminent,"about to happen, occur, or take place very soon"
1807,immiscible,(of two or more liquids) that are not mutually soluble
1808,immoderate,"excessive or lacking, not consistent"
1809,immoral,"not moral, inconsistent with rectitude or good morals"
1810,immovable,"incapable of being physically moved, fixed"
1811,immune,"exempt, not subject to"
1812,immutable,"unchangeable, changeless"
1813,impalpable,"incapable of being perceived by touch, intangible"
1814,impartial,"treating all parties, rivals, or disputants equally, fair"
1815,impassable,"incapable of being passed over, crossed, or negotiated"
1816,impassible,"not allowing passage over, through, along, etc"
1817,impassioned,"filled with intense emotion or passion, fervent"
1818,impassive,"having, or revealing, no emotion"
1819,impeccable,"faultless, flawless, irreproachable"
1820,impecunious,"having little or no money, poor"
1821,impenitent,not feeling regret over one's sins
1822,imperative,essential
1823,imperceptible,"not perceptible, not detectable, too small to be observed"
1824,imperfectible,incapable of being made perfect
1825,imperial,"related to an empire, emperor, or empress"
1826,imperious,"domineering, arrogant, or overbearing"
1827,impermissible,"not permissible, not to be permitted or allowed"
1828,impersonal,"not personal, not having personality"
1829,impersuadable,"not to be persuaded, obstinate, unyielding"
1830,impertinent,"insolent, ill-mannered"
1831,imperturbable,"incapable of being upset or agitated, not easily excited"
1832,impervious,"not permitting penetration or passage, impenetrable"
1833,impetuous,"of, pertaining to, or characterized by sudden or rash action"
1834,impious,"not pious or religious, lacking reverence for god, etc"
1835,implacable,"not to be appeased, mollified, or pacified"
1836,implausible,"not plausible, unlikely, dubious"
1837,impliable,"not pliable, inflexible, unyielding"
1838,implicit,"implied indirectly, without being directly expressed"
1839,impolitic,"not in accordance with good policy, unwise, inexpedient"
1840,impotent,"lacking physical strength or vigor, weak"
1841,impracticable,"not practicable, impossible or difficult in practice"
1842,impromptu,"improvised, without prior preparation, unplanned"
1843,improper,"not proper, not strictly belonging, applicable, etc"
1844,improvident,"failing to provide for the future, reckless"
1845,imprudent,"not prudent, wanting in prudence or discretion, indiscreet"
1846,impudent,"lacking discretion, incautious, rash"
1847,impure,"not pure, mixed with extraneous matter, contaminated"
1848,in medias res,"in the midst of things, to begin in the middle of the action"
1849,inaccessible,"not able to be accessed, out of reach, inconvenient"
1850,inaccurate,"mistaken or incorrect, not accurate"
1851,inactive,"not active, temporarily or permanently"
1852,inadequate,"not adequate, unequal to the purpose, insufficient"
1853,inadmissible,"not admissible, cannot be admitted as evidence at a trial"
1854,inadvertent,unintentional
1855,inadvisable,"unwise, not recommended, not prudent, not to be advised"
1856,inalienable,"incapable of being alienated, surrendered, or transferred"
1857,inane,"lacking sense/meaning, to the point of boredom or annoyance"
1858,inanimate,lacking the quality or ability of motion
1859,inapprehensible,"that cannot be apprehended, not apprehensible"
1860,inapt,"not apt, unsuitable, inept"
1861,inarticulate,"lacking the ability to express oneself, esp. through speech"
1862,inaudible,not able to be heard or not loud enough to be heard
1863,inauspicious,"not auspicious, ill-omened, unfortunate, unlucky"
1864,inborn,"naturally present at birth, innate"
1865,inbred,resulting from or involved in inbreeding
1866,incarnate,"embodied in flesh, given a bodily, especially a human, form"
1867,incendiary,capable of causing fire
1868,inceptive,"beginning, of or relating to inception"
1869,incessant,"continuing without interruption, ceaseless, unending"
1870,inchoate,not yet completed or fully developed
1871,inchoative,"at the beginning, still in an unformed state"
1872,incident,"arising as the result of an event, inherent"
1873,incidental,"loosely associated, existing as a by-product, tangent"
1874,incipient,"a beginning, or first stage"
1875,incisal,relating to the cutting edge of the incisor and cusped teeth
1876,incisive,"penetrating, cutting, biting, trenchant"
1877,inclement,"stormy, of rough weather"
1878,inclusive,the stated limit or extreme in consideration
1879,incoercible,"not to be coerced, incapable of being compelled or forced"
1880,incoherent,"not coherent, not in a consistent fashion"
1881,incombustible,"not capable of catching fire and burning, not flammable"
1882,incomparable,so much better than another as to be beyond comparison
1883,incompatible,"of two things, impossible to coexist, irreconcilable"
1884,incompetent,"unskilled, lacking normally expected degree of ability"
1885,incomplete,"not complete, not finished, not having all its parts"
1886,incomprehensible,impossible or very difficult to understand
1887,incompressible,not compressible
1888,inconceivable,"unable to be conceived, unbelievable"
1889,incongruous,"out of keeping or place, inappropriate, unbecoming"
1890,inconsequential,"having no consequence, of little importance"
1891,inconsiderable,too trivial or unimportant to be worthy of attention
1892,inconsistent,not consistent
1893,inconspicuous,not prominent or easily noticeable
1894,inconstant,"not constant, wavering"
1895,incontrovertible," not open to question or dispute, indisputable"
1896,inconvenient,not convenient
1897,incorrigible,"not corrigible, bad beyond correction or reform"
1898,incredulous,"skeptical, disbelieving, or unable to believe"
1899,incumbent,"holding an indicated position, role, office, etc"
1900,indefatigable,extremely persistent and untiring
1901,indefensible,"not defensible, not capable of being defended, vulnerable"
1902,indefinite,"not definite, without fixed or specified limit"
1903,indelible,"making marks that cannot be erased, removed, or the like"
1904,indescribable,"impossible, or very difficult to describe"
1905,indestructible,"not destructible, incapable of being destroyed, invincible"
1906,indifferent,"not caring, apathetic"
1907,indigenous,"born or engendered in, native to a land or region"
1908,indigent,"lacking food, clothing, etc because of poverty"
1909,indigestible,difficult or impossible to digest
1910,indignant,"showing anger or indignation, esp. at something unjust"
1911,indiscernible,"not discernible, that cannot be seen or perceived clearly"
1912,indiscreet,"not discreet, lacking prudence or circumspection"
1913,indiscriminate,"not discriminating, lacking in care, judgment, etc"
1914,indispensable,"absolutely necessary, essential, or requisite"
1915,indistinct,"not clearly defined or not having a sharp outline, faint"
1916,indivertible,not to be diverted or turned aside
1917,indomitable,"that cannot be subdued or overcome, as persons or courage"
1918,indubitable,"clearly true, providing no possibility of doubt"
1919,industrious,"working energetically and devotedly, hard-working"
1920,inedible,unfit to be eaten
1921,ineffable,incapable of being expressed or described in words
1922,inefficacious,"not able to produce the desired effect, ineffective"
1923,inefficient,unable to achieve the desired result economically
1924,ineligible,"not eligible,  not permitted or suitable"
1925,ineluctable,"incapable of being evaded, inescapable"
1926,inept,"not able to do something, not proficient"
1927,inert,"unable to move or act, inanimate"
1928,inestimable,not able to be estimated as because of great scale or degree
1929,inevitable,impossible to avoid or prevent
1930,inexcusable,not excusable
1931,inexhaustible,"impossible to exhaust, unlimited"
1932,inexorable,"unyielding, unalterable"
1933,inexpedient,"not tending to the end desired, inadvisable, unfit, improper"
1934,inexpensive,low in price
1935,inexplicable,"impossible to explain, not easily accounted for"
1936,inexpressible,unable to be expressed
1937,inextensible,not capable of being extended
1938,inextricable,impossible to untie or disentangle
1939,infallible,"unfailing in effectiveness or operation, certain"
